;doc;source;author;title;year;period;text_type;sentence;collocation;translation;use
121758;TT20spaventosamente.csv;itTenten2020;latelanera.com;latelanera.com;2020.0;2001-2021;web;['il veleno è spaventosamente efficace: a differenza di altri serpenti trattati sulle pagine di latelanera.'];spaventosamente efficace;Das Gift ist erschreckend wirksam: im Gegensatz zu anderen Schlangen, die auf den schwarzen Seitenseiten bedeckt sind;
121776;TT20spaventosamente.csv;itTenten2020;mastertopforum.com;mastertopforum.com;2020.0;2001-2021;web;['l  umanità veniva spaventosamente dilaniata, divorata, falcidiata dalla ferocia e dalla forza del regno animale.'];spaventosamente dilaniato;Die Menschheit wurde von der Wildheit und Stärke des Tierreichs furchtbar auseinandergerissen, verschlungen, niedergemetzelt;
121988;TT20spaventosamente.csv;itTenten2020;blogspot.com;blogspot.com;2020.0;2001-2021;web;['la pressione è spaventosamente gigantesca, tra    mila e    mila libbre per pollice quadrato  psi     ksi    ,    mpa .'];spaventosamente gigantesca;der Druck ist erschreckend gigantisch, zwischen tausend und tausend Pfund pro Quadratzoll psi ksi, mpa;
122178;TT20spaventosamente.csv;itTenten2020;guardachevideo.it;guardachevideo.it;2020.0;2001-2021;web;['a una scena come quella nel video: la piccola prende in mano il cellulare e inizia a simulare un  animata conversazione spaventosamente .'];simulare spaventosamente;zu einer Szene wie im Video: Das kleine Mädchen greift zum Handy und fängt an, ein beängstigend lebhaftes Gespräch zu simulieren;
122190;TT20spaventosamente.csv;itTenten2020;gustadom.it;gustadom.it;2020.0;2001-2021;web;['il finanziamento delega riconosciuto come assegno ha luogo spaventosamente .'];avere luogo spaventosamente;Die als Kontrolle anerkannte Proxy-Finanzierung findet erschreckend statt;
122206;JSIspaventosamente.csv;JSI;italiannetwork.it;italiannetwork.it;2020.0;2001-2021;web;[', come evidenziato, per l  italia la zavorra dell  indebitamento potrebbe oggi non ostacolare un maggior debito , che però peserebbe spaventosamente nel dopo covid   : oltrepassare il  rubicone  del      nel rapporto tra debito e'];pesare spaventosamente;Wie hervorgehoben, könnte für Italien der Schuldenballast heute eine höhere Verschuldung nicht verhindern, die jedoch in der Post-Covid-Zeit furchtbar wiegen würde: das Überschreiten des Rubikons im Verhältnis von Schulden und;
122213;TT20spaventosamente.csv;itTenten2020;wired.it;wired.it;2020.0;2001-2021;web;['il primo dato è un avvicinamento concreto al fotorealismo, con macchine e tracciati spaventosamente fedeli alle controparti originali, da godere a    frame al secondo.'];spaventosamente fedele;Das erste Datum ist eine konkrete Herangehensweise an den Fotorealismus, mit Maschinen und Spuren, die den ursprünglichen Gegenstücken erschreckend treu sind und in Bildern pro Sekunde genossen werden können;
122347;TT20spaventosamente.csv;itTenten2020;ariannaeditrice.it;ariannaeditrice.it;2020.0;2001-2021;web;['il personale addetto alla rete telecom , quello assunto, e   spaventosamente sindacalizzato, e perdipiu   spaventosamente politicizzato.'];spaventosamente sindacalizzato;Das dem Telekommunikationsnetz zugewiesene Personal, das eingestellte, ist erschreckend gewerkschaftlich organisiert und außerdem erschreckend politisiert;
122372;TT20spaventosamente.csv;itTenten2020;noisefromamerika.org;noisefromamerika.org;2020.0;2001-2021;web;['per certo i tassi sul debito schizzerebbero alle stelle, aumentando spaventosamente la spesa pubblica.'];aumentare spaventosamente;sicherlich würden die Schuldenraten in die Höhe schnellen und die öffentlichen Ausgaben dramatisch erhöhen;
122508;TT20spaventosamente.csv;itTenten2020;scacchisticapartenopea.org;scacchisticapartenopea.org;2020.0;2001-2021;web;['in questo tipo di gare il tempo a disposizione per fare le mosse è spaventosamente poco: cinque minuti complessivamente.'];spaventosamente poco;Bei dieser Art von Wettbewerb ist die Zeit, die für die Züge zur Verfügung steht, erschreckend kurz: fünf Minuten insgesamt;
122584;TT20spaventosamente.csv;itTenten2020;wikidot.com;wikidot.com;2020.0;2001-2021;web;"['partendo con la premessa che esistenzialmente hai riciclato un concetto da un videogioco avvicinandoti spaventosamente al limite tra plagio e originalità; il lavoro è comunque mediocre, ma sorprendente per essere un primo articolo.']"; avvicinare spaventosamente;"Beginnend mit der Prämisse, dass Sie ein Konzept aus einem Videospiel existenziell recycelt haben und Sie sich erschreckend nahe an der Grenze zwischen Plagiat und Originalität befinden; die Arbeit ist immer noch mittelmäßig, aber überraschend für einen ersten Artikel";
123079;TT20spaventosamente.csv;itTenten2020;missionecristianaevangelica.it;missionecristianaevangelica.it;2020.0;2001-2021;web;['in quest  opera, satana viene in modo efficiente aiutato dalla collaborazione spaventosamente grande dei suoi numerosissimi seguaci demòniaci.'];spaventosamente grande;Bei dieser Arbeit wird satan durch die erschreckend große Zusammenarbeit seiner zahlreichen dämonischen Anhänger effizient unterstützt;
123088;ita_newscrawl_2020_1M-sentences.txt;Corpora Italian;https://gazzettadireggio.gelocal.it/reggio/cronaca/2019/07/26/news/scandalo-affidi-vicesindaco-di-bibbiano-contro-la-regione-piemonte-una-vergogna-accostarci-all-omerta-su-regeni-1.37200586;https://gazzettadireggio.gelocal.it/reggio/cronaca/2019/07/26/news/scandalo-affidi-vicesindaco-di-bibbiano-contro-la-regione-piemonte-una-vergogna-accostarci-all-omerta-su-regeni-1.37200586;2020.0;2001-2021;stampa;['approda forse alla panchina di villa durazzo pallavicini a genova pegli, spaventosamente fuori contesto perché oggi il parco dà su un autostrada.'];spaventosamente fuori;kommt vielleicht auf der Bank der Villa Durazzo Pallavicini in Genua Pegli an, erschreckend aus dem Zusammenhang gerissen, weil der Park heute eine Autobahn überblickt;
123166;TT20spaventosamente.csv;itTenten2020;wikipedia.org;wikipedia.org;2020.0;2001-2021;web;['gli uomini del pianeta siano molto arretrati culturalmente, imparano con una velocità impressionante: in un tempo spaventosamente breve raggiungeranno il livello culturale e tecnologico dei terrestri, sorpassandolo poi di gran lunga.'];spaventosamente breve;die Menschen des Planeten sind kulturell sehr rückständig, sie lernen mit einer beeindruckenden Geschwindigkeit: in erschreckend kurzer Zeit werden sie das kulturelle und technologische niveau der Erden erreichen und dann bei weitem übertreffen;
123274;TT20spaventosamente.csv;itTenten2020;lellovoce.it;lellovoce.it;2020.0;2001-2021;web;['correre dentro un corpo è spaventosamente sanguinoso, ma la parola è bisturi, dicevamo, spazza tutto, taglia e rimuove, lasciandosi dietro pozze di sangue,'];spaventosamente sanguinoso;In einen Körper hineinzulaufen ist erschreckend blutig, aber das Wort ist Skalpell, sagten wir, fegt alles, schneidet und entfernt und hinterlässt Blutlachen;
123300;TT20spaventosamente.csv;itTenten2020;ingiustizia.info;ingiustizia.info;2020.0;2001-2021;web;['il catalogo degli orrori dei due giornalisti milanesi  l  uno de la repubblica, l  altro del corriere della sera  è spaventosamente ricco di nomi e cognomi, e descrive un paese che, dalla lombardia alla sicilia, non ha risparmiato all  università il'];spaventosamente ricco;der Schreckenskatalog der beiden Mailänder Journalisten, der eine von la repubblica, der andere von corriere della sera, ist erschreckend reich an Vor- und Nachnamen und beschreibt ein Land, das von der Lombardei bis nach Sizilien die Universität nicht verschont hat;
123336;TT20spaventosamente.csv;itTenten2020;farwest.it;farwest.it;2020.0;2001-2021;web;['le munizioni erano diminuite spaventosamente .'];diminuire spaventosamente;Munition war schrecklich zur Neige gegangen;
123413;TT20spaventosamente.csv;itTenten2020;bastabugie.it;bastabugie.it;2020.0;2001-2021;web;['una infermiera pone sul tavolino un bicchiere con una bevanda dal sapore gradevole ma spaventosamente tossica e se ne va, chiudendo la porta.'];spaventosamente tossico;Eine Krankenschwester stellt ein Glas mit einem wohlschmeckenden, aber erschreckend giftigen Getränk auf den Kaffeetisch und geht, schließt die Tür;
123432;TT20spaventosamente.csv;itTenten2020;altervista.org;altervista.org;2020.0;2001-2021;web;['quando è apparso che le lotte di massa si protraevano senza uno sbocco, e il bilancio delle vittime palestinesi era spaventosamente più alto rispetto a quello delle vittime israeliane.'];spaventosamente alto;als sich herausstellte, dass die Massenkämpfe ohne Ausgang weitergingen und die Zahl der palästinensischen Todesopfer erschreckend höher war als die der israelischen Opfer;
123454;TT20spaventosamente.csv;itTenten2020;leonardo.it;leonardo.it;2020.0;2001-2021;web;['tutto nella frazione di secondi, infinitamente,  spaventosamente   dilatati  mi sveglio di soppiatto.'];spaventosamente dilatato;alles im Bruchteil von Sekunden, unendlich, erschreckend erweitert wache ich heimlich auf;
123457;TT20spaventosamente.csv;itTenten2020;parlamentoduesicilie.it;parlamentoduesicilie.it;2020.0;2001-2021;web;['che felice definirebbe  neoborbonici   e che da     anni gli storici  ufficiali  non hanno realizzato  sono spaventosamente più alte di quelle riportate da felice o dallo stesso molfese.'];spaventosamente alto;dass glücklich Neoborbonici definieren würde und die die offiziellen Historiker seit Jahren nicht erkannt haben, sind erschreckend höher als die von Felice oder Molfese selbst berichteten;
123506;TT20spaventosamente.csv;itTenten2020;farefilm.it;farefilm.it;2020.0;2001-2021;web;['ma appena il buio della notte inizierà ad insidiare il gruppo, la leggenda della strega di blair prenderà spaventosamente vita.'];prendere spaventosamente;Aber sobald die Dunkelheit der Nacht beginnt, die Gruppe zu untergraben, wird die Legende der Hexe von Blair auf erschreckende Weise zum Leben erweckt;
123521;TT20spaventosamente.csv;itTenten2020;popsoarte.it;popsoarte.it;2020.0;2001-2021;web;"['alla base i pezzi di ghiaccio si accumulano gli uni sovra gli altri, romponsi in lunghi spacchi, spaventosamente profondi; ergonsi come obelischi, nella cui limpidezza il sole rifrange il settemplice raggio.']";spaventosamente profondo;"an der Basis sammeln sich die Eisstücke übereinander und brechen in lange, erschreckend tiefe Lücken; sie stehen als Obelisken, in deren Klarheit die Sonne den siebenfachen Strahl bricht";
123571;TT20spaventosamente.csv;itTenten2020;metanoauto.com;metanoauto.com;2020.0;2001-2021;web;['ogni    m c  era una rotonda, un semaforo, un camion, o qualcosa che rallentava spaventosamente il tutto.'];rallentare spaventosamente;alle m gab es einen Kreisverkehr, eine Ampel, einen Lastwagen oder etwas, das alles fürchterlich verlangsamte;
123601;TT20spaventosamente.csv;itTenten2020;blogspot.com;blogspot.com;2020.0;2001-2021;web;[' necessitiamo velocemente di un posto dove sederci e mangiare e lo troviamo di fronte alla moschea di solimano: un posto spaventosamente turistico e splendidamente turco allo stesso tempo : d che soddisfa tutti quanti sia come prezzo che come cibo'];spaventosamente turistico;Wir brauchen schnell einen Platz zum Sitzen und Essen und finden ihn vor der Suleiman-Moschee: ein erschreckend touristischer und herrlich türkischer Ort zugleich: d, der sowohl preislich als auch kulinarisch alle zufrieden stellt;
